text,source,url,timestamp,metadata
HIT 갤러리 업데이트 중지 안내 안녕하세요  디시인사이드입니다 디시인사이드는 2023년 10월 6일부터 힛갤러리 업데이트를 중지하기로 하였습니다  그동안 힛갤러리를 이용해 주신 이용자 여러분들께 진심으로 감사드립니다 힛갤러리가 사라지는 것은 아니며  업데이트만 되지 않을 뿐 힛갤러리 열람은 계속 가능합니다  더불어 기존에 힛갤러리 등록자에게 지급되던 배지와 갤러콘  배지 7개 수집 시 제공되던 기념품 또한 중단됩니다 다만 1년 내 갤러리 활동이 있고  배지를 4개 이상 모은 이용자분들께는 소정의 기념품을 드리려고 합니다 대상이 되는 아래 닉네임 식별코드 의 이용자분께서는 기념품을 받을 이름과 주소  연락처를 정확히 기재하셔서 기한 내에 contents dcinside com으로 신청을 해주시면 됩니다  1  개인 정보   이름  신분증사본 이름만 노출  나머지는 가려주세요   주소  연락처2  디시인사이드 식별코드와 닉네임3   기념품 수령을 위한 개인 정보 수집  이용에 동의합니다  문구를 작성해 주세요   신청 기한   2023년 11월 5일 일요일까지  경품은 기한 내 신청해 주신 분들에 한해 발송됩니다   개인 정보는 기념품 발송을 위해 불가피하게 수집하고 있으며  이외의 목적으로는 활용되지 않습니다  개인 정보는 기념품 발송 처리 이후 즉시 파기됩니다   배지 4개   31명닉네임   식별코드kain_y   sunoh486모오오오닝   wldwld25개구락찌   mgrtt313232정배추   psg00limzi   ggoo88끾뀪이   kr5843DBshotgun   hex66환타스틱프렌즈   wer2006미용실형   kwgisddn도식   tkwls2105Jayhan   jhhan0981유스더유스   six6200나날123   skskf123치바사진충   carpenters0414무선혜드셋   dpk58172HMC   mycro123유동성   asher5A18   cartoon4794금요정   goldpixie우용곡   dndudwp99셋하나둘은둘셋하나   xodidclq고래군   shurueder기행문   wlrnqhs33포스퍼거   maxleo415고기집아들   caramel92맑음소녀    battery9806르름   freshly7sT   anjfhgkwl11랜스암   jjs1166칰타   pdj2887photographer   beautyfindstudio  배지 5개   23명닉네임   식별코드뻬인타놉   rhzkahzk펜형   pentakuMilK   msicom아마추어   lego1677푸리케츠   fv215b불효좌   assp01296롬롬_   seoromaATM   atm0419머큘   merkurykimLEO10   exaid4358스파츠 SpatZ    myeungin찬성    chanseong09까나디엥   tom229증조할배   oms1541고랭순대   sundaemasterRURO   kimhay15  김지민  jss8831윤선생   109yyi스틸리젼 잡스    satan66666666666D   6chaonㅇuㅇ   ginjaji 유동닉   toyroom45812b   kimsoso  배지 6개   25명닉네임   식별코드샤전용   jf2337ssv   songsuv무배추무   gim2140FallOut   qprktm난로   hhb0424레고전함   choi75095애긔늬   yjs98Le7els   ekqhr2뤂   luffyLivingstar   playacous1 신세기    gkalsl123heeeeya   skarn오프더레코드   noel84291주_멘   yojoygキセキヒカル   dpfvm12345단양   dkwkrudgus수석어시   aapvrh22끄아악   akdlxk김인기   rladlsrl94ROWN   kaejooTapclay   tapclay초록괴물A   seungbo2000우치우   wonwoo422취미맨   gdfreemanmask   mask1919,dcinside,https://gall.dcinside.com/board/view/?id=hit&no=17784&page=1,2025-10-15 16:56:04.481064,"{""gallery_id"": ""hit""}"
"힛갤 기념품 변경 안내 - 갤로그 배지, 갤러콘 안녕하세요  디시인사이드입니다   2021년 6월 14일부터  힛갤에 등록된 힛갤러 분들께는 기존에 배송됐던 기념품 대신 온라인에서 사용하는 갤로그 배지와 힛갤 갤러콘을 드립니다  1  갤로그 배지 갤로그 배지는 힛갤 등록 시점에 본인의 갤로그에 자동 노출되며  동일한 아이디로 등록한 힛갤에 한해서 개수가 집계됩니다  다른 아이디로 등록 시 당첨 횟수가 달라질 수 있으므로 꼭  한 개의 아이디로 등록해 주세요  또한 본인의 요청으로 힛갤이 삭제될 경우 해당 게시물로 받으신 갤로그 배지는 무효가 되며  상품을 받을 수 있는 7개 집계 수량에서 제외됩니다  이전과 같이 배지 7개가 되면 소정의 기념품 또는 상품권이 지급됩니다  상품은 배지 7개 완료시 운영자의 확인을 거친후 자동 지급되며  본인의 방명록을 통해 지급 완료 및 사용 방법에 대해 안내해 드립니다  참고로 기존에 받으셨던 기념품은 동일 아이디에 한하여 갤로그 배지에 합산됩니다  2  갤러콘 지급 7일간  갤러콘은 힛갤 등록 시점에 해당 아이디로 자동 지급되며  7일간 사용하실 수 있습니다  힛갤 갤러콘 사용을 원치 않으실 경우 OFF 설정이 가능합니다  3  비회원 안내 갤로그 배지와 힛갤 갤러콘은 회원의 경우 자동으로 제공되며  비회원의 경우는 회원 가입 후 신고 게시판에 원본 게시물의 IP주소와 동일한 IP로 게시물을 남겨 주시거나 본인임을 확인할 수 있는 게시물을 작성해 주시면 해당 아이디 힛갤 게시물도 새로 가입하신 아이디로 변경됩니다 로 갤로그 배지 및 갤러콘이 지급됩니다  단  신청일 기준으로부터 1년이 경과된 힛갤 게시물은 상품을 받을 수 있는 집계 수량에서 제외됩니다   더불어 갤러리 하단의  힛갤로  버튼도 많이 이용해 주세요   힛갤로 버튼이란  감사합니다   3줄 요약  힛갤 기념품이 변경되었습니다   온라인에서 사용 가능한 갤로그 배지와 힛갤 갤러콘이 지급됩니다   기존에 받았던 기념품도 갤로그 배지와 합산되어 7개가 되면 소정의 기념품 또는 상품권을 드려요                                                                                               이전 지급 방식    2013년 1월 1일부터 힛갤에 선정되신 분들께 기념품을 드립니다  안녕하세요  디시인사이드입니다  2013년 1월 1일부터 힛갤에 등록되신 힛갤러 분들께 기념품을 보내드립니다  디시 로고가 각인된 기념품 총 7개를 모으시는 분들께는 소정의 상품과 교환해 드립니다   기념품은 동일한 아이디로 등록된 힛갤에 한해서 운영자의 확인을 거쳐 디시 로고가 각인된 기념품이 순차적으로 배송됩니다  다른 아이디로 등록시 당첨 횟수가 달라질 수 있으므로 꼭  한 개의 아이디로 등록해주세요   단  양도된 것은 무효입니다  또한 본인의 요청으로 힛갤이 삭제될 경우 해당 게시물로 받으신 힛갤 기념품은 무효화 되며  상품을 받을 수 있는 7개 기념품 수량에서 제외됩니다  힛갤에 선정 되신 힛갤러 분들은 오른쪽 상단의 관련 갤러리 https   gall dcinside com list php id hitg 를 클릭하신 후 게시판에 배송 받으실 주소와 우편번호 반송 우려가 있으니 꼭  도로명 주소를 남겨주세요 를 올려주세요   단  힛갤 경품은 국내배송만 가능합니다  해외에서 올리신 분은 국내로 받을 주소로 올려주십시오   회원의 경우는 로그인 후 올려 주시고  비회원의 경우는 회원 가입 후 원본 게시물의 IP 주소와 동일한 IP로 배송지를 남겨 주시면 됩니다   비회원의 힛갤 등록은 동일한 닉네임과 아이피일 경우에만 이전 등록된 힛게시물과 합산이 가능합니다   소정의 상품은 만두 아닙니다       기념품은 힛갤 등록일 기준 1년 이내에 신청 가능합니다  1년이 지난 후에는 신청하실 수 없습니다  더불어 갤러리 하단의  힛갤로  버튼도 많이 이용해 주세요   힛갤로 버튼이란  감사합니다",dcinside,https://gall.dcinside.com/board/view/?id=hit&no=16435&page=1,2025-10-15 16:56:04.680119,"{""gallery_id"": ""hit""}"
힛갤에 등록된 게시물은 방송에 함께 노출될 수 있습니다. 안녕하세요 디시인사이드입니다 힛갤에 등록된 게시물은 방송 등에 노출될 수 있습니다 감사합니다,dcinside,https://gall.dcinside.com/board/view/?id=hit&no=9640&page=1,2025-10-15 16:56:04.957531,"{""gallery_id"": ""hit""}"
메피스토펠레스 완성 + 제작 과정 이 글은 제작 과정을 위주로 담았으니 전체적인 외관 모습은 이 글을 참고 https   m dcinside com board lobotomycorporation 1643440  창작 정보대회  메피스토펠레스 만들어 봄   로보토미 코퍼레이션 마이너 갤러리림버스 컴퍼니의 버스  메피스토펠레스를 만들었음사실 내부가 미완성이지만 올려도 된대서 올려봄내부까지 완성 다 하면 제작 과정까지 해서 올려보겠음전체샷재료는 포맥스  아크릴 등을 사용했고 겉부분에 코팅한 종이를 잘라서 m dcinside com드디어 림버스 컴퍼니의 버스  메피스토펠레스를 완성했음 재료는 포맥스  아크릴  등등 이건 저번 글에선 미완이라 보여주지 못한 내부 모습 바닥에 순접 자국 남은 게 아쉽다 이쪽은 운전석 토끼 인형을 따로 인쇄해서 마지막에 붙였는데 처음부터 같이 만들 걸 그랬다    구석에 붙이기 힘들었음 이건 제작에 사용했던 참고자료랑 리소스들임 메피스토펠레스가 일러스트마다 세부 디자인이 전부 달라서 내 마음대로 수정을 거쳤음 먼저 도면을 인쇄해서 포맥스에 붙여줌 그 다음 도면대로 열심히 자름 저 창문 구멍 뚫기가 제일 힘들었다    포맥스 더럽게 안 잘림 버스 옆면에 있는 분쇄기 입구도 만들어주고 버스 문도 좌우로 열리게 만들어 줄 거임 이제 아크릴로 창문을 만든 후 합쳐주자 아크릴 부러짐   그래도 멀쩡한 부분이 많이 남았으니 계속 진행 창문도 붙여주고 합체 끝 옆면을 세워봤는데 아직까지 형태는 안 보이는 것 같다 이제 내부에 벽을 인쇄해서 붙임 저 때는 풀을 써서 붙였는데 접착이 제대로 안 됐는지 자꾸 떨어지려 하더라 그래서 이후에는 풀 대신 순접을 썼음 아까 만들었던 문을 빼내서 작은 창문을 달아줌 다시 문을 끼워주고 잘 열리는지 확인 이제 버스 바닥을 만드는데 뭔가 아차 싶더라 계단 공간 안 만들고 아무 생각 없이 붙여버림   바닥 조심히 뜯어내고 급하게 계단 만들어서 붙임 반대쪽 벽과 바닥을 합체하기 전에 버스 옆면에 있는 분쇄기를 만들어 보자 분쇄기의 날 모양에 맞게 포맥스를 잘라줌 기분탓인지는 모르겠는데 검은색 보다 회색 포맥스가 더 잘 잘리더라 하나하나 잘라서 만들었는데 손가락 엄청 아팠음 사포질 한다고 날을 쥐고 갈았는데 뾰족한 부분이 손가락 끝을 파고들더라    이제 하나로 만들고 버스 옆면에 부착 근데 뭔가 마음에 안 들어서 다시 만들었음 사포질 한다고 손가락 아파서 죽을 맛 바닥이랑 벽을 합쳤는데 아직까지도 이게 버스가 맞나  싶긴 함 근데 애초에 메피스토펠레스는 버스보단 기차에 가깝지 않나 아무튼 이제 버스 지붕을 만들자 천장엔 led를 달아서 내부에 불이 들어오게 할 거임 납땜을 하고 글루건으로 고정 납땜 처음 하는데 전선끼리 연결할 때가 어렵더라 지붕을 만들고 결합 지붕을 만드니까 형태가 슬슬 보인다 지붕은 벽에 있는 틈 사이로 끼웠다 뺄 수 있게 만들었음 지붕 완성 이제 기차처럼 생긴 버스 앞 부분을 만들 거임 바깥 부분을 만들고 내부는 안쪽에 끼워서 만들었음 지금 보니 오른쪽 종이 위아래 반대로 붙였네   그리고 잠시 지붕을 뜯어내서 굴뚝과 조명을 만들어줌 저 애매하게 휘어있는 부분을 만들기 힘들었음 드라이기로 몇 분을 지졌는지 모르겠다 그리고 굴뚝을 지붕과 연결한 후 원상복구 해줌 굴뚝에도 조명이 있는 걸 알았으면 처음부터 이렇게 만들었을 텐데    앞 부분에 있는 조명을 달아주고 이걸 뭐라고 부르지 범퍼  가드  어쨌든 이것도 메피스토펠레스의 포인트니까 만들어 줌 앞부분에 장착 이걸로 앞부분도 완성 이제 뒷면을 만들어 줌 원래는 저 뒷문도 열리게 만들고 싶었는데 공간이 부족해서 포기하고 포맥스 여러 겹으로 입체감을 주는 것으로 마무리 뒷면은 창문도 뭣도 없으니까 되게 밋밋함 이제 코팅한 종이를 겉에 붙여줌 원래는 인화용지에 인쇄해서 붙이고 싶었는데 색이 자꾸 바래서 일반 용지에 코팅을 하는 것으로 마무리 겉면에 붙이는 것도 끝 명색이 버스인데 바퀴가 없으면 안 되니 바퀴를 만들어 줌 빨대랑 나무젓가락으로 만들어서 굴러가기도 한다 그리고바닥에 부착 밑면은 지저분한 회로가 보인다 이걸로 외부는 끝났으니 내부를 만들자 계기판이랑 무슨 모니터를 만들었음 계기판이랑 모니터에 붙은 스티커 만들기 힘들었는데 정작 인쇄하니 잘 안 보여서 아쉬움 의자는 이런 식으로 전개도에 뼈대를 넣고 그대로 접어서 완성 운전석  핸들  기어봉  카론의 토끼 인형까지 전부 완성 다 만들고 보니 핸들이 많이 큰 거 같다 이제 자리에 맞게 의자를 붙여줌 운전석 벽이랑 버스 기둥과 손잡이까지 달아주면 내부도 완성  기둥 배치는 사라지네 일러스트 참고함 이놈의 일러스트는 기둥 배치도 다 다름   조금조금씩 만들다 보니 몇 달 동안 만들었네 다 만들고 나니까 뿌듯하다 마지막은 홉킨스 갈갈이로 마무리 봐줘서 고마움  창작 정보대회  메피스토펠레스 만들어 봄 보러가기출처  로보토미 코퍼레이션 갤러리  원본 보기,dcinside,https://gall.dcinside.com/board/view/?id=hit&no=17809&page=1,2025-10-15 16:56:05.725429,"{""gallery_id"": ""hit""}"
야쿠르트 아줌마의 비밀병기 시리즈  단편   트랜스 파머  고라니의 서막  스압  이전 단편을 먼저 보고 보시면 좋습니다 끝 변신 합체 전 모음 변신 합체 후 모음 제작기간 약 두달 단편 촬영기간 6일 기존에 제작한 야쿠르트 아줌마 프레시 매니저  에다가 헐크버스터를 모티브로 추가 파츠를 합체시키는 작품을 만들어 봤습니다 이번 단편에서 미사일이나 주먹 맞대는 등의 연출은 또 처음 시도해보는거였는데 생각한 만큼 나오진 않아 아쉬움이 남긴 하네요 이번 작품은 좀 특별하게 에치와이 한국야쿠르트 와 협업하여 만들게 된 작품입니다 여러분의 많은 관심 덕분에 이런 경험도 해보게 됐습니다 정말 감사합니다 본래 제작을 한달에서 한달 반 정도 생각했던 작품이였으나   먹는 제품을 활용하고  다루기 어려워하는 곡선 위주라서 생각보다 시간을 많이 잡아먹었네요 한달에 한 작품 정도로 연말까지 생각한 계획이 있었는데 두녀석 정도 생략될듯 합니다 최대한 빠르게 다음 작품 들고올 수 있도록 노력해보겠습니다 봐주셔서 감사합니다  시리즈  변신로봇시리즈    농촌시리즈  고라니   이장님의 비밀병기   경운기 피규어 만들어왔습니다   야쿠르트 아주머니   이번에 공모전 낸 녀석들   메카제로사이온 만들어봤습니다   개인 엠블럼 토이 만들어봄   크리스마스에도 변신로봇   군대에서 만든 토이 完    군대에서 만든 토이 4  리마스터   종이로 만든 전술차량   군대에서 만든 토이 3  이 글도 힛갤에 갈 수 있을지 없을지 모르겠지만   업데이트 마지막 전날에 최대한 올려봅니다 힛갤 안녕    출처  토이 갤러리  원본 보기,dcinside,https://gall.dcinside.com/board/view/?id=hit&no=17808&page=1,2025-10-15 16:56:06.259248,"{""gallery_id"": ""hit""}"
"첫 해외 여행, 일본 갔다온 망가 시리즈  싸돌아다니기 시리즈   진짜 뒤지게 늦은 서울코믹월드 후기 망가   적당히 늦은 코스프레 축제 후기 망가   예비군 갔다가 만화축제 가서 멜로디언 부는 망가   모르는 아저씨와 크리스마스에 서울코믹월드 가는 망가 출처  카툰 연재 갤러리  원본 보기",dcinside,https://gall.dcinside.com/board/view/?id=hit&no=17807&page=1,2025-10-15 16:56:06.781389,"{""gallery_id"": ""hit""}"
"그 시절, 우리가 사랑했던 디시인사이드...manhwa 꼭 노래와 함께 들어주세요     추억팔이 밤샘      출처  카툰 연재 갤러리  원본 보기",dcinside,https://gall.dcinside.com/board/view/?id=hit&no=17806&page=1,2025-10-15 16:56:07.054207,"{""gallery_id"": ""hit""}"
7년간 존버한 수제 커피만들기.coffee 오늘은 직접 집에서 커피를 만들어보겠습니다 제작기간은 총 7년 걸렸습니다 먼저 쿠팡에서 커피 묘목을 구매합니다 커여운 묘목들입니다 제가 다 키우긴 귀찮아서 하나 빼고 다 지인들에게 줘버렸습니다3년동안 키운 묘목입니다졸라 안큽니다 5년동안 키운 묘목알고보니 실내에서 기르니 햇빛을 많이 못받아 졸라 작았던것이었습니다양지바른곳으로 옮긴뒤 폭풍성장꽃도나고열매도 달렸습니다 진작 볕 잘드는곳에서 키울걸 그랬습니다 커피가 익어가는중빨갛게 잘익었습니다길쭉한 사과처럼 생겼습니다수확16년도 10월에 시작했으니 여기까지 딱 7년 걸렸습니다 건조이제 분해를 시작합니다힘들게 껍질을 제거해줍니다열매 5알에서 반알씩 총 10알이 나옵니다속껍질을 제거해줍니다 10알중 5알만 살아남았습니다 수율이 5할이 약간 넘습니다 쌀알과 비교전문 로스팅 기구가 없으니 후라이팬에 볶아줍니다들들들들볶는동안 제 커여운 고양이를 봐주시기 바랍니다볶기가 완료되었습니다 그럴싸한 커피냄새가 납니다 전동 그라인더나 믹서같은데 갈면 수율이 3할도 안나올거같아서 밀대로 직접 뽀갰습니다뽂뽂뽂뽂분쇄완료카누 0 9g 과 비교뜨신물에 잘 우려줍니다음    거름망으로 걸러줍니다커피가 완성되었습니다 평가 예전 카페에서 일할 때 에스프레소를 우린 찌꺼기로 몇 번이나 커피를 뽑을 수 있나 실험한 적 있습니다 커피찌꺼기 5번 우린 물 맛입니다 시간 노력 대비 가성비가 좋지는 않군요그래도 한번 재미 삼아 해보긴 좋은 것 같습니다  출처  식물 갤러리  원본 보기,dcinside,https://gall.dcinside.com/board/view/?id=hit&no=17805&page=1,2025-10-15 16:56:07.492576,"{""gallery_id"": ""hit""}"
