text,source,url,timestamp,metadata
스압) 고대 이집트 컨셉의 키보드 빌드해봄 0  서론 때는 5월달 창고에서 썩어가던 시뻘건 키보드를 컨셉을 맞춰서 빌드하고 싶기에 황금색 재아노를 보내며 나의 애굽키보드 구상은 시작되었다  그리고 와버리고 말았다     그러면 서론은 끝내고 키보드를 빌드해보자 1  키보드 제작사 소개 이 키보드 이름은 aaru tkl 이라고 하며 2020년 9월 내수공제를한 모델이다 제작사는 Helix lab 이라는 회사에서 제작하였다  Helix lab 을 잘 모르는 키붕이가 더 많을거라 생각하여 간단하게 말해보자면 이 회사 수상할정도로 이집트에 진심이다 ㅋㅋㅋ 고대 이집트에 관심이 많다면 한번쯤 관심 가지는것도 추천하고싶다   참고로 이집트 회사 느낌이지만 무려 중국회사인게 웃기다  그럼 빌드를 시작해보자  2  키보드 외관 박스에서부터 꽤나 애굽스러운 향기가 난다 하우징의 재아노는 정확히는 회황색으로 모래의 느낌이 나도록 의뢰하였음  고대 이집트의 상형문자들이 양각으로 새겨져있는게 유물 느낌이 난다 ㅋㅋㅋ 2 1  기보강 조립 이렇게 덩그러니 있는 기판을 채워보자 우선 스테빌  나는 체리 스크류인  이퀄츠 철심만을 따로 모딩 없이 사용하려고해  체리 스테빌은 저 뎀퍼를 안자르면 먹먹하고 잡소리가 있으므로 꼭 자르도록   이  렇  게 빠르게 스테빌을 윤활하고 조립 후 정성과 사랑을 담은 스테빌을 기판에 장착 특이하게 제공되는 기보강 흡음제가 실리콘이더라고 원래 노폼으로 하려다 궁금해서 그냥 넣어봤어ㅋㅋ 그리고 보강판을 올리면 뼈대는 끝  사용할 스위치는 Black lotus 스위치야 왜 이 스위치를 사용하냐고    그러면 아주 짧게 설명하고 갈게 대충 통일 이집트 이전의 이집트는 나일강을 중심으로 명칭을 달리 불렀어 위쪽은 상이집트 아래는 하이집트 그 상이집트의 상징중 하나가 연꽃이기에 기보강의 상부에 컨셉을 잡아 끼워줬어  공장윤활은 준수하니 순정으로 사용하고 다 장착하면 상기보강은 끝  상기보강을 만들었으니 이제 하기보강을 만들게 아까 상이집트는 연꽃이였으니 하부는 파피루스로 만들어야겠지  우선 마스킹 테이프를 붙여주고 양면테이프를 그 위에 또 붙여줘 그리고 파피루스 종이를 기판 하부에 붙여주면 하기보강은 끝  허전해서 그림도 그려봤어   왼쪽부터 크리보    어둠의 유희    블랙매지션 이거지 ㅋㅋㅋ 2 2  하우징 조립 위에 만들어놓은 기보강을 끼우기 위해서 분해되있는 하우징을 조립해야겠지  상부 하부를 분리하고 작업을 보내기 전 분해해놓은 파츠들을 분해의 역순으로 조립   무게추 이쁜듯 ㅋㅋㅋ 나는 약간의 통울림을 좋아하기에 하부에 흡음제는 사용 안할게 2 3  하우징에 기보강 장착 아까 기보강 조립때 코인물들 이라면 이 키보드가 탑마운트 결합방식인걸 알거야 그래서 상부 하우징에 나사홀이 꽤 많지  그러면 나사를 박아서 기보강을 상부에 달아주고 하부하우징과 조립하면 90  완성    2 4 키캡 이번에 사용할 키캡은 컨셉에 맞춰서 gmk 파라오 키캡을 사용했어 이런 플라스틱이 20만원   하지만 예쁘지  그러면 키캡을 다 끼워주면     완성   무려 이집트 컨셉 키보드지만 유일한 메이드 인 이집트인 파피루스 종이 위에서   캬  마음에 든다 ㅋㅋㅋ 타건음은 무너졌냐 하는 키붕이들을 위해서 타건음도 올렸삼     dc official App출처  기계식키보드 갤러리  원본 보기,dcinside,https://gall.dcinside.com/board/view/?id=hit&no=17628&page=4,2025-10-15 16:57:39.060622,"{""gallery_id"": ""hit""}"
두정갑을 만들어 보자 [완][스압] 두정갑을 만들어 보자 1   견철 제작안녕 철붕이들 요즘 한복에 빠져있는 나 두정갑도 직접 만들어 입어보기로 작정을 했지 먼저 금속 장식물중 하나인  견철 을 만들어 보고자 해 견철이 무엇이냐 한국식 두정갑에만 있는 특징인데 칼로부터 어깨를 보호하는 금속 장신구야  매우 힙하지 이걸 구해보려고 해도 구해지지가 않더라고 그래서 직접 만들어보기로 한다 인터넷으로 황동 사각봉이라고 재료를 팔더라고 가장 두꺼운 10mm로 두개 구매완료 황동봉의 실물사진 이정도 두께면 칼날로부터 어깨를 충분히 막을것 같지 이제 황동봉을 연마기를 이용해 둥글게 갈아보는거야 아파트집에서 하면 쇳가루 날리니까  시골집 작업실에서 갈아보자 갈갈갈갈     이런식으로 조금씩 둥글게 둥글게    완성 집에 돌아오는 차안에서 찍었어 매우 이쁘고 둥글게 잘된 것 같아   이제 견철을 삼등분으로 잘라줄건데 각각 7cm  9cm  11cm 로 잘라줄거야 핸드그라인더를 이용해서    꽤 두껍고 단단해서 한번에 안잘리네 손이 아파 ㅠㅠ절단 완성 이제 날카로운 금속이바리 Burr 를 제거해 주자 금속줄로 슥삭스삭 연결부위인 요철도 각 0 8cm씩 핸드그라인더로 만들어주자  요철부위 접합 완성 결합부위 구멍을 뚫어주고     리벳을 박아주면 완성   팔을 위 아래로 들어올려도 불편함이 없도록 자유롭게 움직일 수 있도록 만들었어 내 어깨에도 한번 대보자 어깨사이즈에도 딱 맞는 것 같아 이제 두정갑의만 완성되면 되겠어 두정갑이 이쁘게 완성될 수 있도록 모두 기도해줘   두정갑을 만들어 보자 2   두정갑의 옷  만들기안녕 철붕이들 두정갑을 직접 만들어보는 두번째 시간이야 두정갑의 기본이 되는 옷  갑의를 만들거야 사실 옷 만드는 능력은 없기 때문에 전문가 선생님께 주문제작을 의뢰했어   이렇게 겉감  속감  안감을 별도로 사다가 주문제작을 맏기는거야 도안은 유물을 토대로 부탁드렸어 예전 조상님들 옷은 사이즈가 작아서 내 몸에 맏게 좀 키웠는데 사이즈가 잘못될까봐 엄청 조마조마 하면서 맏겼어   긴 시간이 흐른 후 완성된 두정갑의는 바로 아래와 같아 실제 유물과 똑같이 생긴 디자인  단추까지 튼튼하게 달아주셔서 너무 만족했어 겉감이 녹색  안감이 회색  속감이 광목천으로 3겹으로 만들어진 갑의야 바로 입어보면 이런 느낌 두정작업은 안되었으니 갑옷 느낌이라기보다는 외투의 느낌이 강하지 근데    색상이 생각보다 밝아서 맘에 안드네 염색을 해서 어둡게 가라앉혀 보자고 염색에 사용된 검정색 염료 더럽고 힘든 염색과정은 과감히 생략 매우 어두운 다크올리브그린 색으로 나왔어 색상이 아주 맘에 든다 여기서 살짝 한복차림으로 입어보도록 하자 밀리터리 철릭에 입어보니 생각보다 군복같아서 잘 어울리네 다음시간에는 두정갑의 안에 박을 갑찰을 만들어보도록 하자고 그럼 이만   두정갑을 만들어 보자 3   갑찰 만들기안녕 철붕이들 바로 이어서 갑찰 만드는 시간이야 갑찰이란 두정갑 내부에 실질적인 방어력을 갖는 철 혹은 가죽 판을 말해 길게 말할 것 없이 유물 사진들을 보자고 이건 철로된 갑찰유물 이건 가죽으로 된 갑찰유물 나는 착용감이 좋은 가죽용 갑찰을 만들어볼까 해 2mm두께의 소가죽 원단을 준비해보도록 하자 7cm   10cm 크기로 치수를 재 준 후 가죽칼로 잘라주자 어려운건 없는 단순 반복 작업  노동요 틀고 작업하길 추천해 가죽염색약으로 색을 낸후 잘라도 보자 너무하얀색이면 가죽느낌이 안살거든 단순 반복 노가다의 작업   일본산 가죽 경화제  카타메루 저 작은통 하나가 2만원이 넘었던가 그럴거야 그래도 제값은 하니까 꼭 사용하도록 하자 옆면이 너무 거칠면 내몸을 찌르고 옷감도 상하게 하니까 가죽연마를 하도록 하지 부드럽게 만들어줘 하루동안 만든 갑찰의 양 이것만으론 갑찰이 부족해  똑같은짓을 두번 더하지만 과감하게 생략할게 ㅠㅠ이 갑찰을 어떻게 하느냐 저번시간에 만든 두정갑의에 박는것만 남았지 가죽을 덧댈 위치에 갖다 대 보자 대략 이런느낌으로 두정작업을 할거야 그럼 다음시간에 보자고 이만   두정갑을 만들어 보자 4   두정 리벳 작업안녕 철붕이들 지난시간에는 가죽 갑찰을 만들었고 오늘부터는 갑찰을 다는 작업을 할거야 가죽 자체를 직접 달 수는 없으니  두정 리벳 을 달 수 있도록 구멍을 뚫어주어야 겠지 많은 갑찰들을 준비해 주고 가죽 펀칭기를 이용해서 구멍을 뚫어주자 짜잔 리벳을 쏙하고 잘들어가네 매우 쉽지 하지만 양이 많아  노동요를 꼭 틀고 작업하자 ㅠㅠ일단 어깨부분에 견철을 덧댈 가죽을 달아주고 시작하자 견철 사이즈에 맞게 가죽을 잘라주고 가죽 염색약과 영양제를 발라주면 준비 끝 견철이 닿는 부분에 바느질 시작   바느질이 엄청 귀찮고 힘들더라고  다시는 하기 싫은작업이었어  견철부위 가죽 덧댐 완료 이제 진짜 두정작업을 시작하도록 하자고 두정 박을 위치를 표시해 두고  송곳을 이용해 리벳이 들어갈 수 있도록 구멍을 뚫어주자 사용될 리벳금속이 옷감을 헤치지 않도록 완충제인 와셔를 넣어주고 구멍에 쏘옥 넣어준다음 리벳 장비를 이용해 박아주면 완료 공정 자체는 단순하지 양이 많을뿐   계속 구멍을 뚫어주고 계속 박아주고 이렇게 어깨부분이 완성 살짝 걸쳐볼까 이제 좀 두정갑의 테가 나는듯 하지 기쁜마음에 작업의 강행군 시작 또 열심히 송곳으로 구멍을 뚫어주고    준비된 리벳들 구멍에 제대로 넣어주고세게 눌러주면 끝 후우 이제좀 두정갑 테가 나기 시작하네 의자에 걸어보면 대략 이런느낌 걸쳐보면 이런 느낌  또 열심히 뚫어주고 가죽을 또 채워주고 이렇게 완성 두정작업이 너무 힘들다 ㅠㅠ완성된 두정갑을 유물처럼 펼쳐보도록 할게 너무 커서 지저분한 바닥이지만 그냥 펼쳐보았어 나 너무 뿌듯하네 ㅠㅠ철붕이들은 절대 따라 하지말자  나도 두번은 안 만들것 같아 견철 다는걸 빼먹었네 견철 위치에 구멍을 뚫어주고 실로 연결 끝 진짜 완성 이제 완성 됬으면 착용해 봐야겠지 철릭 위에 입어보도록 하자 파란 철릭 위에 녹색 두정갑  사이즈는 찰떡같이 맞아 어깨부분의 견철 위치도 매우 딱 맞아 장구류 및 갓도 착용한 후 한컷 다시한번 강조하지만  철붕이들은 따라하지마  너무 힘들어 ㅠㅠ그리고 완전 완성된건 아니니까 추가 장구류 제작기도 추가할 거야 투구나 포백대 등 아직 갈길이 멀었어 모두 완성되는 그날까지 모두 건강하길 빌어 그럼 이만   두정갑을 만들어 보자 5   투구  포백대안녕 철붕이들 두정갑만 입는다고 복장이 완성되는것은 아니지 이번에 만들 물건은 투구와 포백대야 먼저 투구를 알아보자  투구 조선시대 투구는 크게 첨주형과 간주형으로 나뉘어져 있어 내가 만들어볼 투구는 첨주형 투구야 처음부터 만들면 힘드니까 편법을 써보자 첨주형 투구의 경우 동서양을 막론하고 모두 사용하던 양식이거든 미국에서 중세시대 첨주형 투구를 파는사람이 있군 이녀석을 이용해서 투구를 만들어보는거야    약 2주만에 도착  녹슬지 말라고 기름을 잔뜩 범벅칠해놨네 알코올을 이용해서 기름을 제거해 주고 무광락카칠로 도색 완료 써보면 이런느낌이야 아직까지는 조선의 느낌은 없는 강철투구네 정수리에 구멍을 뚫어주고 전등 갓용 청동 갓장식을 투구에 달아주도록하자 짜잔  첨주형 투구 완성 근데       투구용 술이 싸구려 합성 술이다보니 코스프레 느낌이 나고  생각보다 어울리지 않네   진짜 말총을 달아줘야겠어  바이올린용 말총을 싸게 파니까 이걸 이용해보자 염색은 가죽용 붉은색 염색약으로 염색했어 염색 후 말리는중    색상이 너무 붉어 검은색을 좀더 섞어주자 최종적으로 첨주형 투구 완성  착용하면 이런느낌  색감이 매우 맘에 들게 잘 나왔네                                                                                                                                                            포백대 다음은 포백대야 포백대란 무엇이냐 허리에 덧대는 두꺼운 천벨트라고 생각하면 될 것 같아 옷 위에 바로 장구류를 차게되면 옷감이 헤지거나 찢어기 쉽고  장구류 끈이 흘러내리기도 하거든 포백대를 차면 매우 단단하게 고정되고  옷감이 헤지는 것을 막아주기도 하지 옷감류 만드는건 어렵기 때문에 시장에 있는 한복집에 가서 주문제작을 맡겼어 서산에서는 한복 주문제작은 여기가 최고 짜잔  약 2주만에 주문제작 포백대 완성 한복집 사장님도 이런거 처음만들어본다고 재밌어 하셨음 ㅎ앞으로도 계속 이용할 예정이야 포백대의 색상이 밝으니 어둡게 염색해주자 갈색으로 했더니 좀 붉은 느낌이 드네 좀더 어둡게 염색 ㄱㄱ두정갑과 어울리는 어두운색으로 잘 염색되었다   그럼 두정갑과 포백대를 착용해보자 블랙벨트는 튼튼해서 한번더 감아줬어 저 위에 나머지 광다회나 벨트를 매면 흘러내리지 않아서 좋더라고 다음은 투구도 착용해보자 검도 호면쓸때 사용하는 면수건을 써주자 땀이 눈쪽으로 흘러내리는 것도 막아주고  강철투구와의 완충역할을 해주니 매우 필요해 햇빛가리개용 검은면도 써주자 첨주형 투구 착용 기본 군복세팅 끝 나머지 장구류도 갖추고 밖으로 나가볼까 장구류를 착용하니 묵직하네 선산에도 올라보자 수련용 가검이니 안심하십시오 여름인데 생각보다 날씨가 선선해서 나쁘지 않아 이젠 조선 갑사복장 구색을 갖춘 것 같아 기쁘네 철붕이들도 전통복장에 관심이 생겼으면 좋겠다 끝 출처  철물 갤러리  원본 보기,dcinside,https://gall.dcinside.com/board/view/?id=hit&no=17627&page=4,2025-10-15 16:57:39.673419,"{""gallery_id"": ""hit""}"
미래가젯1호 드디어 완성! 이번에 미래가젯1호 만들어볼 생각임저번 ibn처럼 배선하다 망할까 봐 배선 미리 해봄 아두이노 쓸지 몰라서 4 5일 동안 리모컨 만들다 방금 성공함  미래가젯 1호 모델링 드디어 끝남모델링을 잘 못해서 반 노가다로 하다 보니 생각보다 너무 오래 걸림이제 인쇄하고 미친 듯이 사포질해야지  미래가젯1호 가조립미래가젯1호 인쇄 끝나서 가조립 한번 해봄  미래가젯1호 90  진행됨거의 모든 부품의 도색이 끝났고 끝에 총구 부분하고 내용물만 만들면 끝인데  지금 총구만 4번째 만드는 거임처음에 만들던 거는 만들다 떨궈서 작살났고  2번쨰는 레진 조색제가 락카 녹여서 망하고  3번쨰는 빠르게 만들라고 UV레진으로 만들다 망함근데 9일부터 10일 정도 여행 가서 여행 가기 전에 완성하고 싶었는데  2주는 있어야 완성될 거 같네  미래가젯1호 드디어 완성 2월쯤부터 만들기 시작했으니까  한 3 4개월 정도 걸려서 드디어 완성함일단 미래가젯1호의 디자인이 애니  게임  피규어가 전부 미묘하게 다르고  심지어 크리스 피규어랑 오카베 피규어에 들어가있는 것도 서로 다르게 생김그래서 설정집에 들어있는 디자인을 베이스로 만듬이거는 모델링하기 전에 모눈종이에 설계한 설계도임이거는 저번에 올린 모델링 사진이게 완성품인데  레이저 부분이 레진으로 코팅을 한번 해야 되는데 크리스탈 레진을 실리콘 몰드에 부어서 하다가 3 4번 정도 망해서 uv레진으로 바르고 굳히고 하는 식으로 만든 거라 좀 지저분함내부는 아두이노 나노를 이용해서 만든 리모컨을 넣었음  원래는 다이소 만능 리모컨 넣으려다 너무 커서 인터넷에 아두이노로 리모컨 만든 사람 있길래 참고해서 만듬뒤쪽 열면 아두이노에 연결 가능하게 해서 코드 수정하면 TV리모컨 말고도 에어컨 리모컨 같은 거로도 쓸 수 있음건전지는 9V 건전지 사용함  원래는 일반 리모컨처럼 AA나 AAA건전지 2개 넣는 식으로 만들고 싶었는데  아두이노가 5V 이상의 전력을 연결해야 돼서 아쉽지만 9V 건전지 사용함이거는 내가 쓰는 모니터에 실제로 사용하는 모습임  IBM 5100 모형 씽기버스에 IBM 5100 모형 공유한 파일이 있어서 만들어 봤어요남은 도료로 적당히 칠한 거라 색이 좀 이상하네요나중에 슈타게에 나오는 IBN 5100 디자인으로 실제 사이즈 케이스 만들어서 패미컴 이식해 볼 생각입니다이름하여 IBN 5100 Portable Family Computer  참고로 이런 마개조 처음이라 실패할 확률이 굉장히 높습니다  IBN5100 패미컴 제작 근황  모델링 완료 예전에 올렸던 IBN5100모형 글에서 말한 IBN5100 모양 패미컴의 케이스 모델링이 완료되었습니다현재 3D프린터로 인쇄 중인데  3D프린터로 인쇄 가능한 사이즈가 크지 않아서 다 인쇄하려면 1달 이상은 걸릴 듯  반년 전에 시작한 IBN5100 제작  드디어 도색 끝남 6월쯤부터 만들기 시작한 패미컴 IBN5100이 드디어 도색 끝났습니다  이제 로고 같은 거 붙이고 패미컴 배선만 남았으니 1월 초 정도면 완성할 거 같네요 만드는데 이렇게 오래 걸릴지 몰랐는데  다음부터 이렇게 큰 거는 절대 안 만들기로 다짐했습니다  저기에 붙이려고 만든 로고인데 잘 만들어져서 자랑 겸 같이 올림   IBN 5100 제작 끝남결론부터 말하면 실패함 ㅋㅋㅋ패미컴 배선 작업하는데 스피커도 안 나오고 lcd도 안 나오고  어쩄든 실패했습니다 그래서 그냥 포기하고 외관만 작업해서 마무리했어요 그래서 전원 키면 led 등은 켜지게 만들었습니다 솔직히 디자인도 엉성한 부분이 많았고  전기 배선 같은 것도 야매로 도전한 거다 보니까 이정도 만든 것만으로도 만족은 합니다 기회가 된다면 언젠가 다시 만들어볼 생각입니다 출처  슈타인즈 게이트 갤러리  원본 보기,dcinside,https://gall.dcinside.com/board/view/?id=hit&no=17626&page=4,2025-10-15 16:57:40.006022,"{""gallery_id"": ""hit""}"
[해병공작] 황근출 해병님 피규어 제작 오늘은 황근출 해병님 피규어를 제작해보겠습니다준비물은 잘 숙성된 해병된장 2 2 2 2 2kg입니다작업대입니다다이소에서 천원에 사왔습니다해병된장을 절반 덜어줍니다해병된장 숙성이 잘돼서 그런지 단단하여 모양 잡는게 쉬운 일이 아닙니다대강의 구조를 잡아줍니다해병된장 겉면이 마르지 않게 청정해병수를 발라주면서 함문촉촉 해병님을 만듭니다황근출 해병님의 2 2 2 2팩입니다몸통에 선을 두개 통과시켜줍니다용도는 좀이따 나옵니다대강의 모양잡기가 끝났습니다다듬어줍니다팔각모를 씌워드립니다몸통은 대강 끝났습니다팔을 달아드립니다자료를 참고하면서 팔근육을 다듬어줍니다다이소 공작도구로 다듬어줍니다슥슥팔각모에 이름을 써드립니다대강 완성되었습니다이제 개씹썅말좆오도짜세기합해병으로 탈바꿈 하기 위해 몇가지 도구를 준비합니다아까 뒤로 뺀 선입니다앞에 있는 선에 적색 LED를 달아줍니다아두이노 키트에 간단한 회로를 구성해 연결해줍니다간단한 예제코드를 가져와 업로드합니다우리 해병대 전우들은 모두 해병코딩을 학습하여 이정도는 문제없습니다새끼    기열        번쩍번쩍무드등으로도 활용 할 수 있습니다  시리즈  해병만화    해병만화  해병할로윈 manhwa  上    해병만화  해병할로윈 manhwa  下    해병만화  해병할로윈2    해병만화  해징어게임  예고편    해병만화  해징어게임  기열다리건너기    해병만화  해징어게임  식사시간    해병만화  해징어게임  해병달고나    해병만화  해징어게임  해병구슬치기    해병만화  해징어게임  마지막 게임   完   시리즈  해병요리    해병요리  해병짜장 만들기    더러움주의  해병초콜릿 만들기 출처  해병대 갤러리  원본 보기,dcinside,https://gall.dcinside.com/board/view/?id=hit&no=17625&page=4,2025-10-15 16:57:40.449105,"{""gallery_id"": ""hit""}"
냉혹한 뒷세계의 해결사.manhwa 출처  카툰 연재 갤러리  원본 보기,dcinside,https://gall.dcinside.com/board/view/?id=hit&no=17624&page=4,2025-10-15 16:57:40.755683,"{""gallery_id"": ""hit""}"
